{
  "schema_version": 4,
  "minimum_generator_version": "0.3.7",
  "contexts": [
    {"id": "msvc-x64-debug", "platform": "x64", "arch": "x64", "configuration": "Debug", "toolchain": "msvc", "backend": "msbuild", "role": "development", "features": []},
    {"id": "cmake-msvc-x64-debug", "platform": "x64", "arch": "x64", "configuration": "Debug", "toolchain": "msvc", "backend": "cmake", "role": "component-pilot", "features": []},
    {"id": "cmake-msvc-x64-release", "platform": "x64", "arch": "x64", "configuration": "Release", "toolchain": "msvc", "backend": "cmake", "role": "component-pilot", "features": []},
    {"id": "msvc-x64-release", "platform": "x64", "arch": "x64", "configuration": "Release", "toolchain": "msvc", "backend": "msbuild", "role": "distribution", "features": ["ltcg"]},
    {"id": "mingw-x64-debug", "platform": "MinGW", "arch": "x64", "configuration": "Debug", "toolchain": "mingw", "backend": "cmake", "role": "experimental", "features": []},
    {"id": "mingw-x64-release", "platform": "MinGW", "arch": "x64", "configuration": "Release", "toolchain": "mingw", "backend": "cmake", "role": "experimental", "features": []}
  ],
  "components": [
    {
      "id": "sakura_app",
      "family": "legacy",
      "kind": "executable",
      "maturity": "legacy",
      "build_definition": "legacy",
      "supported_contexts": ["msvc-x64-debug", "cmake-msvc-x64-debug", "msvc-x64-release", "cmake-msvc-x64-release", "mingw-x64-debug", "mingw-x64-release"],
      "owner": "sakura_core",
      "sources": ["sakura_core", "src/main/cpp/cxx"],
      "public_headers": [],
      "private_headers": [],
      "ownership_exclusions": ["sakura_core/platform/uri", "sakura_core/include/sakura/uri", "sakura_core/platform/serialization", "sakura_core/include/sakura/serialization", "sakura_core/platform/filesystem", "sakura_core/include/sakura/filesystem", "sakura_core/platform/security/CurrentUserSecurityAttributes.cpp", "sakura_core/platform/security/AuthenticodeSignatureVerifier.cpp", "sakura_core/include/sakura/security", "sakura_core/platform/storage/CAtomicFileStorageService.cpp", "sakura_core/platform/storage/CAtomicFileStorageService.h", "sakura_core/platform/storage/StorageTypes.cpp", "sakura_core/platform/storage/StorageSnapshotCache.cpp", "sakura_core/include/sakura/storage", "sakura_core/platform/request", "sakura_core/include/sakura/request", "sakura_core/platform/controlipc/ControlIpcProtocol.cpp", "sakura_core/platform/controlipc/ControlIpcNamedPipeTransport.cpp", "sakura_core/platform/controlipc/ControlPlatformEndpoint.cpp", "sakura_core/platform/controlipc/security", "sakura_core/include/sakura/controlipc", "sakura_core/workbench/editor/selection/SelectionSession.cpp", "sakura_core/include/sakura/editor/SelectionSession.h", "sakura_core/workbench/editor/frame/EditorFrameEvents.cpp", "sakura_core/window/Win32EditorFrameAdapter.cpp", "sakura_core/include/sakura/editor/EditorFrameEvents.h", "sakura_core/include/sakura/editor/win32/Win32EditorFrameAdapter.h", "sakura_core/workbench/editor/document/DocumentSession.cpp", "sakura_core/include/sakura/editor/document", "sakura_core/_main/editor_lifecycle/EditorAppLifecycle.cpp", "sakura_core/include/sakura/editor/lifecycle", "sakura_core/include/sakura/shareddata", "sakura_core/platform/harnessbridge", "sakura_core/include/sakura/harnessbridge", "sakura_core/terminal/tmux/TmuxArgumentParser.cpp", "sakura_core/terminal/tmux/TmuxArgumentParser.h", "sakura_core/terminal/tmux/TmuxCli.cpp", "sakura_core/terminal/tmux/TmuxCli.h", "sakura_core/terminal/tmux/TmuxCommandDispatcher.cpp", "sakura_core/terminal/tmux/TmuxCommandDispatcher.h", "sakura_core/terminal/tmux/TmuxCommandTypes.h", "sakura_core/terminal/tmux/TmuxFormatEvaluator.cpp", "sakura_core/terminal/tmux/TmuxFormatEvaluator.h", "sakura_core/terminal/tmux/TmuxTargetResolver.cpp", "sakura_core/terminal/tmux/TmuxTargetResolver.h", "sakura_core/terminal/cli"],
      "public_include_roots": [],
      "private_include_roots": ["."],
      "state_owner": "legacy application and process state",
      "implementation_language": "cpp",
      "cargo_package": null,
      "cargo_target": null,
      "link_artifact": null,
      "authority_domain": "application-process-state",
      "authority_mode": "legacy-production",
      "thread_affinity": "ui-thread",
      "lifecycle_owner": "sakura_app",
      "side_effects": ["process-lifecycle"],
      "provider_by_context": {"msvc-x64-debug": "sakura_app", "cmake-msvc-x64-debug": "sakura_app", "cmake-msvc-x64-release": "sakura_app", "msvc-x64-release": "sakura_app", "mingw-x64-debug": "sakura_app", "mingw-x64-release": "sakura_app"},
      "backend_targets": {"msbuild": ["sakura_core/sakura.vcxproj"], "cmake": ["sakura"]},
      "compile_profile": null,
      "system_libraries": ["advapi32", "bcrypt", "comctl32", "crypt32", "d2d1", "dbghelp", "dwmapi", "dwrite", "htmlhelp", "imm32", "mpr", "msimg32", "ole32", "oleacc", "oleaut32", "shlwapi", "uiautomationcore", "uuid", "uxtheme", "version", "windowscodecs", "winhttp", "winmm", "winspool", "wintrust"]
    },
    {
      "id": "tests1",
      "family": "legacy-tests",
      "kind": "test",
      "maturity": "legacy",
      "build_definition": "legacy",
      "supported_contexts": ["msvc-x64-debug", "cmake-msvc-x64-debug", "msvc-x64-release", "cmake-msvc-x64-release", "mingw-x64-debug", "mingw-x64-release"],
      "owner": "src/test",
      "sources": ["src/test"],
      "public_headers": [],
      "private_headers": [],
      "ownership_exclusions": [],
      "public_include_roots": [],
      "private_include_roots": ["."],
      "state_owner": "legacy test process state",
      "implementation_language": "cpp",
      "cargo_package": null,
      "cargo_target": null,
      "link_artifact": null,
      "authority_domain": null,
      "authority_mode": "none",
      "thread_affinity": "unspecified",
      "lifecycle_owner": null,
      "side_effects": [],
      "provider_by_context": {},
      "backend_targets": {"msbuild": ["sakura_core/tests1.vcxproj"], "cmake": ["tests1"]},
      "compile_profile": null,
      "system_libraries": ["advapi32", "bcrypt", "comctl32", "crypt32", "d2d1", "dbghelp", "dwmapi", "dwrite", "gdiplus", "htmlhelp", "imagehlp", "imm32", "mpr", "msimg32", "ole32", "oleacc", "oleaut32", "psapi", "shlwapi", "uiautomationcore", "uuid", "uxtheme", "version", "windowscodecs", "winhttp", "winmm", "winspool", "wintrust"]
    },
    {
      "id": "sakura_terminal_tmux_core",
      "family": "terminal-harness",
      "kind": "implementation",
      "maturity": "independent",
      "build_definition": "generated",
      "supported_contexts": ["msvc-x64-debug", "cmake-msvc-x64-debug", "msvc-x64-release", "cmake-msvc-x64-release", "mingw-x64-debug", "mingw-x64-release"],
      "owner": "sakura_core/terminal/tmux",
      "sources": ["sakura_core/terminal/tmux/TmuxArgumentParser.cpp", "sakura_core/terminal/tmux/TmuxCli.cpp", "sakura_core/terminal/tmux/TmuxCommandDispatcher.cpp", "sakura_core/terminal/tmux/TmuxFormatEvaluator.cpp", "sakura_core/terminal/tmux/TmuxTargetResolver.cpp"],
      "public_headers": ["sakura_core/terminal/tmux/TmuxArgumentParser.h", "sakura_core/terminal/tmux/TmuxCli.h", "sakura_core/terminal/tmux/TmuxCommandDispatcher.h", "sakura_core/terminal/tmux/TmuxCommandTypes.h", "sakura_core/terminal/tmux/TmuxFormatEvaluator.h", "sakura_core/terminal/tmux/TmuxTargetResolver.h"],
      "private_headers": [],
      "ownership_exclusions": [],
      "public_include_roots": ["sakura_core"],
      "private_include_roots": [],
      "state_owner": null,
      "implementation_language": "cpp",
      "cargo_package": null,
      "cargo_target": null,
      "link_artifact": null,
      "authority_domain": null,
      "authority_mode": "none",
      "thread_affinity": "any-thread",
      "lifecycle_owner": null,
      "side_effects": [],
      "provider_by_context": {},
      "backend_targets": {"msbuild": ["src/main/modules/generated/msbuild/projects/sakura_terminal_tmux_core.vcxproj"], "cmake": ["sakura_terminal_tmux_core"]},
      "compile_profile": null
    },
    {
      "id": "sakura_harnessbridge",
      "family": "terminal-harness",
      "kind": "implementation",
      "maturity": "independent",
      "build_definition": "generated",
      "supported_contexts": ["msvc-x64-debug", "cmake-msvc-x64-debug", "msvc-x64-release", "cmake-msvc-x64-release", "mingw-x64-debug", "mingw-x64-release"],
      "owner": "sakura_core/platform/harnessbridge",
      "sources": ["sakura_core/platform/harnessbridge/HarnessBridgeAuthenticatedSession.cpp", "sakura_core/platform/harnessbridge/HarnessBridgeBroker.cpp", "sakura_core/platform/harnessbridge/HarnessBridgeCapability.cpp", "sakura_core/platform/harnessbridge/HarnessBridgeClientSession.cpp", "sakura_core/platform/harnessbridge/HarnessBridgeEndpoint.cpp", "sakura_core/platform/harnessbridge/HarnessBridgeEnvironment.cpp", "sakura_core/platform/harnessbridge/HarnessBridgeNamedPipeTransport.cpp", "sakura_core/platform/harnessbridge/HarnessBridgeOperationDispatcher.cpp", "sakura_core/platform/harnessbridge/HarnessBridgeProtocol.cpp", "sakura_core/platform/harnessbridge/HarnessBridgeSecurity.cpp", "sakura_core/platform/harnessbridge/HarnessBridgeServiceHost.cpp"],